[
  {
    "variant_id": "V001",
    "market": "US",
    "language": "en",
    "channel": "social_1_1",
    "size": "1080x1080",
    "aspect_ratio": "1:1",
    "headline": "Summer Sale",
    "subheadline": "Save up to 30% today",
    "cta": "Shop Now",
    "legal_disclaimer_id": "DISCLAIMER_US_001",
    "product_image_id": "prod_001",
    "background_image_id": "bg_001",
    "compliance_version": "v1",
    "approved": true
  },
  {
    "variant_id": "V002",
    "market": "US",
    "language": "en",
    "channel": "social_16_9",
    "size": "1920x1080",
    "aspect_ratio": "16:9",
    "headline": "Summer Sale",
    "subheadline": "Save up to 30% today",
    "cta": "Shop Now",
    "legal_disclaimer_id": "DISCLAIMER_US_001",
    "product_image_id": "prod_001",
    "background_image_id": "bg_001",
    "compliance_version": "v1",
    "approved": true
  },
  {
    "variant_id": "V003",
    "market": "DE",
    "language": "de",
    "channel": "social_1_1",
    "size": "1080x1080",
    "aspect_ratio": "1:1",
    "headline": "Sommerverkauf",
    "subheadline": "Bis zu 30% sparen",
    "cta": "Jetzt einkaufen",
    "legal_disclaimer_id": "DISCLAIMER_DE_001",
    "product_image_id": "prod_001",
    "background_image_id": "bg_002",
    "compliance_version": "v1",
    "approved": true
  },
  {
    "variant_id": "V004",
    "market": "FR",
    "language": "fr",
    "channel": "print_a4",
    "size": "A4",
    "aspect_ratio": "",
    "headline": "Soldes d'été",
    "subheadline": "Économisez jusqu'à 30%",
    "cta": "Achetez maintenant",
    "legal_disclaimer_id": "DISCLAIMER_FR_001",
    "product_image_id": "prod_002",
    "background_image_id": "bg_001",
    "compliance_version": "v1",
    "approved": false
  }
]
